[
  {
    "customer_id": "CUST-1001",
    "baseline_avg_daily_spend": 0.05,
    "current_cycle_start": "2026-09-01",
    "current_mrc_billed_last_cycle": 42.0
  },
  {
    "customer_id": "CUST-1002",
    "baseline_avg_daily_spend": 0.1,
    "current_cycle_start": "2026-09-01",
    "current_mrc_billed_last_cycle": 28.0
  },
  {
    "customer_id": "CUST-1003",
    "baseline_avg_daily_spend": 0.15,
    "current_cycle_start": "2026-09-01",
    "current_mrc_billed_last_cycle": 14.0
  },
  {
    "customer_id": "CUST-1004",
    "baseline_avg_daily_spend": 0.2,
    "current_cycle_start": "2026-09-01",
    "current_mrc_billed_last_cycle": 45.0
  },
  {
    "customer_id": "CUST-1005",
    "baseline_avg_daily_spend": 0.05,
    "current_cycle_start": "2026-09-01",
    "current_mrc_billed_last_cycle": 26.0
  },
  {
    "customer_id": "CUST-1006",
    "baseline_avg_daily_spend": 0.05,
    "current_cycle_start": "2026-09-01",
    "current_mrc_billed_last_cycle": 40.0
  },
  {
    "customer_id": "CUST-1007",
    "baseline_avg_daily_spend": 0.08,
    "current_cycle_start": "2026-09-01",
    "current_mrc_billed_last_cycle": 42.0
  },
  {
    "customer_id": "CUST-1008",
    "baseline_avg_daily_spend": 0.1,
    "current_cycle_start": "2026-09-01",
    "current_mrc_billed_last_cycle": 84.0
  },
  {
    "customer_id": "CUST-1009",
    "baseline_avg_daily_spend": 0.09,
    "current_cycle_start": "2026-09-01",
    "current_mrc_billed_last_cycle": 150.0
  },
  {
    "customer_id": "CUST-1010",
    "baseline_avg_daily_spend": 0.1,
    "current_cycle_start": "2026-09-01",
    "current_mrc_billed_last_cycle": 52.5
  },
  {
    "customer_id": "CUST-1011",
    "baseline_avg_daily_spend": 0.1,
    "current_cycle_start": "2026-09-01",
    "current_mrc_billed_last_cycle": 53.16
  },
  {
    "customer_id": "CUST-1012",
    "baseline_avg_daily_spend": 0.09,
    "current_cycle_start": "2026-09-01",
    "current_mrc_billed_last_cycle": 38.0
  },
  {
    "customer_id": "CUST-1013",
    "baseline_avg_daily_spend": 0.15,
    "current_cycle_start": "2026-09-01",
    "current_mrc_billed_last_cycle": 35.5
  },
  {
    "customer_id": "CUST-1014",
    "baseline_avg_daily_spend": 0.11,
    "current_cycle_start": "2026-09-01",
    "current_mrc_billed_last_cycle": 33.0
  },
  {
    "customer_id": "CUST-1015",
    "baseline_avg_daily_spend": 0.05,
    "current_cycle_start": "2026-09-01",
    "current_mrc_billed_last_cycle": 47.0
  },
  {
    "customer_id": "CUST-1016",
    "baseline_avg_daily_spend": 0.05,
    "current_cycle_start": "2026-09-01",
    "current_mrc_billed_last_cycle": 15.0
  },
  {
    "customer_id": "CUST-1017",
    "baseline_avg_daily_spend": 0.14,
    "current_cycle_start": "2026-09-01",
    "current_mrc_billed_last_cycle": 42.0
  },
  {
    "customer_id": "CUST-1018",
    "baseline_avg_daily_spend": 0.0,
    "current_cycle_start": "2026-09-01",
    "current_mrc_billed_last_cycle": 42.0
  },
  {
    "customer_id": "CUST-1019",
    "baseline_avg_daily_spend": 0.09,
    "current_cycle_start": "2026-09-01",
    "current_mrc_billed_last_cycle": 30.0
  },
  {
    "customer_id": "CUST-1020",
    "baseline_avg_daily_spend": 0.1,
    "current_cycle_start": "2026-09-01",
    "current_mrc_billed_last_cycle": 42.0
  },
  {
    "customer_id": "CUST-1021",
    "baseline_avg_daily_spend": 0.1,
    "current_cycle_start": "2026-09-01",
    "current_mrc_billed_last_cycle": 42.0
  },
  {
    "customer_id": "CUST-1022",
    "baseline_avg_daily_spend": 0.09,
    "current_cycle_start": "2026-09-01",
    "current_mrc_billed_last_cycle": 38.0
  },
  {
    "customer_id": "CUST-1023",
    "baseline_avg_daily_spend": 0.1,
    "current_cycle_start": "2026-09-01",
    "current_mrc_billed_last_cycle": 57.0
  },
  {
    "customer_id": "CUST-1024",
    "baseline_avg_daily_spend": 0.06,
    "current_cycle_start": "2026-09-01",
    "current_mrc_billed_last_cycle": 42.99
  },
  {
    "customer_id": "CUST-1025",
    "baseline_avg_daily_spend": 0.09,
    "current_cycle_start": "2026-09-01",
    "current_mrc_billed_last_cycle": 38.0
  },
  {
    "customer_id": "CUST-1026",
    "baseline_avg_daily_spend": 0.1,
    "current_cycle_start": "2026-09-01",
    "current_mrc_billed_last_cycle": 42.35
  }
]